{
  "$schema":"https://json-schema.org/draft/2020-12/schema","$id":"https://schemas.example.invalid/legal-chatbot/v1/provider-config-view.schema.json","title":"Provider configuration view","description":"Version-neutral additive LATER lifecycle representation only. ACTIVE is not runtime activation: it requires separately approved validated configuration and is enforced by service transaction/lock, single answer Provider and rollback invariants.","x-owner":"provider-service","$ref":"#/$defs/ProviderConfigView",
  "$defs":{"ValidationSummary":{"type":"object","properties":{"status":{"type":"string","minLength":1},"checked_at":{"$ref":"common.schema.json#/$defs/Timestamp"},"reason_codes":{"type":"array","items":{"$ref":"common.schema.json#/$defs/ReasonCode"},"uniqueItems":true}},"required":["status","checked_at"],"additionalProperties":false},"ProviderConfigView":{"type":"object","properties":{"provider_config_id":{"$ref":"common.schema.json#/$defs/Id"},"display_name":{"type":"string","minLength":1},"provider_kind":{"type":"string","minLength":1},"endpoint_profile_id":{"$ref":"common.schema.json#/$defs/Id"},"capabilities":{"type":"array","items":{"type":"string","minLength":1},"uniqueItems":true},"status":{"type":"string","enum":["DRAFT","VALIDATED","ACTIVE","DISABLED","RETIRED"]},"configuration_ready":{"type":"boolean"},"revision":{"$ref":"common.schema.json#/$defs/Revision"},"last_validation":{"$ref":"#/$defs/ValidationSummary"}},"required":["provider_config_id","display_name","provider_kind","endpoint_profile_id","capabilities","status","configuration_ready","revision","last_validation"],"additionalProperties":false}}
}
